{"comparable":true,"comparison_id":"cmp_b360d395a4e2a592761f22d4","comparison_status":"DRIFT","comparison_type":"SAME_PLAN_RERUN","differences":[{"baseline":true,"baseline_present":true,"path":"/assertions/suite-completed-successfully/actual","repeat":false,"repeat_present":true},{"baseline":"PASS","baseline_present":true,"path":"/assertions/suite-completed-successfully/status","repeat":"FAIL","repeat_present":true},{"baseline":0,"baseline_present":true,"path":"/assertions/suite-has-zero-failures/actual","repeat":1,"repeat_present":true},{"baseline":"PASS","baseline_present":true,"path":"/assertions/suite-has-zero-failures/status","repeat":"FAIL","repeat_present":true},{"baseline":[{"attachments":[],"evidence_type":"automated.test-summary","parser_version":"evidence-json/0.1","redacted":true,"redacted_fields":1,"redaction_rule_version":"privacy/0.1","retention":"local-default","source":"VeriTrail deterministic fixture"}],"baseline_present":true,"path":"/evidence_shape","repeat":[{"attachments":[],"evidence_type":"automated.test-summary","parser_version":"evidence-json/0.1","redacted":false,"redacted_fields":0,"redaction_rule_version":"privacy/0.1","retention":"local-default","source":"VeriTrail deterministic failure fixture"}],"repeat_present":true},{"baseline":["ALL_DECISIVE_ASSERTIONS_PASSED"],"baseline_present":true,"path":"/reason_codes","repeat":["DECISIVE_ASSERTION_FAILED"],"repeat_present":true},{"baseline":"PASS","baseline_present":true,"path":"/verdict","repeat":"FAIL","repeat_present":true}],"limits":["MATCH 表示 M6 冻结语义投影一致，不等于来源 Run 的 Verdict 为 PASS。","本比较不支持不同 Plan 的处理组因果归因。","未进入 sealed assertion 或 Evidence 形态的原始业务事实不在本结论范围内。"],"reasons":[{"code":"RERUN_SEMANTIC_DRIFT","message":"冻结语义投影存在 7 处差异。"}],"rule_version":"rerun-semantic/0.1","schema_version":"0.1","sources":{"baseline":{"bundle_sha256":"3a4c48dd49d71fcec69f7014fbc9ec5a87005ca7f2d3a94e944131b58338e4c8","created_at":"2026-08-09T03:22:40.696871Z","execution_status":"COMPLETED","plan":{"id":"m0-fixture-pass","sha256":"90235a18c59e9f30cd2aa519d281a4fdb18f04e83bdf2fcc5ff98770dba8a2b8","version":1},"random_seed":20260809,"role":"BASELINE","run_id":"m6-minimal-pass-20260809","semantic_sha256":"f423cba4a68466fe55f99e9247ee0cb6152e51e0a8efc85605c0a7ecade43ba9","verdict":"PASS"},"repeat":{"bundle_sha256":"1ee8523a927513b0a9cc89eef3b105f7b2a15d7b1ead918463cab01f7742ed86","created_at":"2026-08-09T03:22:40.982165Z","execution_status":"COMPLETED","plan":{"id":"m0-fixture-pass","sha256":"90235a18c59e9f30cd2aa519d281a4fdb18f04e83bdf2fcc5ff98770dba8a2b8","version":1},"random_seed":20260809,"role":"REPEAT","run_id":"m6-minimal-fail-20260809","semantic_sha256":"a0b4616167a48dbf2ca42995a16934b01673af93b1c215d2074bbf827814bcd0","verdict":"FAIL"}}}
